id;kanji;jlpt;joyo_reading;reading;on;kun;on_trans;kun_trans
582;悟;1;ゴ、さと-る;;go;"perceive, discern, realize, understand, comprehend; attain enlightenment, find one's philosophy";sato(ru);"perceive, discern, realize, understand, comprehend; attain enlightenment, find one's philosophy"
583;碁;1;ゴ;キ;go;"Japanese checkers";-;-
584;語;5;ゴ、かた-る、かた-らう;;go;"word, speech, language, term";"kata(ru), kata(rau)";"talk, tell, narrate, recite. chat; pledge one's troth; invite, entice; win; conspire with"
585;誤;3;ゴ、あやま-る;;go;"err, be mistaken; do wrong, mislead";ayama(ru);"err, be mistaken; do wrong; mislead"
586;護;1;ゴ;まも;go;"defend, protect; keep, observe, obey; abide by; stick to; be true to";-;-
587;口;4;コウ、ク、くち;;"koo, 	ku";mouth;kuchi;"mouth, lips; speech, words; one's taste, stopper, plug; nozzle, orifice, slit, aperture; door, gate, entrance; route, ascent; employment, job; call (for a doctor); share; kind, lot, brand; beginning; rumor, opening (of a boil)"
588;工;4;コウ、ク;たくみ;"koo, 	ku";"artisan, mechanic; manufacture; work";-;-
589;公;2;コウ、おおやけ;ク、グ、きみ;koo;"public, duke, lord; public";ooyake;"public, open; official, governmental; formal"
590;勾;0;コウ;ま;koo;"to bent";-;-
591;孔;1;コウ;ク、あな;koo;"hole, aperture, slit; gap, stop (of musical instrument); eyelet; cavity; socket; cave; den; hiding place; pit; fault, defect; deficit; grave; dark horse";-;-
592;功;1;コウ、[ク];いさお;"koo, [ku]";"merits, meritorious deeds; success; credit, honor; effect; class (in court orders)";-;-
593;巧;1;コウ、たく-み;;koo;skilled;taku(mi);"skill, ingenuity"
594;広;4;コウ、ひろ-い、ひろ-まる、ひろ-める、ひろ-がる、ひろ-げる;;koo;"spread out, extend, reach to";"hiro(i), hiro(maru), hiro(meru), hiro(garu), hiro(geru)";"spread out, extend, reach to. expand, enlarge, widen; unfurl; open (arms of a package), stretch, spread. be diffused, prevail, be propagated, prevade, be circulated, become popular. enlargel; disseminate; popularize; advertise, introduce, announcement, advertisement. wide, broad, extensive, spacious"
595;甲;1;コウ、カン;きのえ、かぶと;"koo, 	kan";"high (voice). first class； former； back (of the hand); instep; armor; shell, tortoise shell, carapace";-;-
596;交;3;コウ、まじ-わる、まじ-える、ま-じる、ま-ざる、ま-ぜる、か-う、か-わす;;koo;"coming and going, association; change of seasons";"maji(waru), maji(eru), maji(ru), ma(zaru), ma(zeru), ka(u), ka(wasu)";"associate with, mingle with; interest; join. mix; converse with, cross (swords). blend, mingle; include, let in on. be mixed, be blended. exchange (messages); dodge, parry, avoid, turn aside"
597;光;3;コウ、ひか-る、ひかり;;koo;light;"hika(ru), hikari";"shine, glitter, sparkle, twinkle, flash. light, beam, glare, gleam, glimmer, glow, brightness, radiance, glitter, luster; influence (of parents)"
598;向;3;コウ、む-く、む-ける、む-かう、む-こう;キョウ、さき;koo;"face, confront; oppose, defy; proceed to; get, tend toward; approach";"mu(ku), mu(keru), mu(kau), mu(koo)";"face, confront; oppose, defy; proceed to; get, tend toward; approach. turn; point (a gun); send (a messenger of letter). (a needle) points to; lean towards; front on; suit. the other side; opposite direction; the other party; destination; the next (few years); opposition to"
599;后;1;コウ;ゴ、きさき;koo;"after; behind; back; later";-;-
600;好;3;コウ、この-む、す-く;よしみ、よ;koo;"like, be fond of";"kono(mu), su(ku)";"like, be fond of. Love"
601;江;1;コウ、え;;koo;"inlet, bay";e;"inlet, bay"
602;考;4;コウ、かんが-える;;koo;"thought, consideration; research, treatise ";kanga(eru);"think, consider, believe, suspect; be of the opinion; intend; expect, hope, fear; judge, conclude; imagine, suppose; regard as; be discreet; ponder over; reconsider; be prepared for; invent "
603;行;5;コウ、ギョウ、[アン]、い-く、ゆ-く、おこな-う;;"koo, 	gyoo, [an]";"party, suite; journey; expedition; line, row. religious austerities. ";"i(ku), yu(ku), okona(u)";"go; run (water). do, act, conduct oneself; carry out; perform, conduct (school); exercise (control); hold (a ceremony) "
604;坑;1;コウ;あな;koo;"pit, hole";-;-
605;孝;1;コウ;;koo;"filial piety";-;-
606;抗;1;コウ;あ;koo;"resist, defy, oppose, antagonize";-;-
607;攻;1;コウ、せ-める;おさ;koo;"attack, assault";se(meru);"attack, offensive"
608;更;3;コウ、さら、ふ-ける、ふ-かす;が;koo;"a watch of the night";"sara, fu(keru), fu(kasu)";"sit up late. get late; grow old; reach the height of the season. again; after all; more and more"
609;効;2;コウ、き-く;;koo;"efficacy, benefit; efficiency; effect, result; success";ki(ku);"be effective"
610;幸;3;コウ、さいわ-い、さち、しあわ-せ;みゆき;koo;"happiness, fortune";"saiwa(i), sachi, shiawa(se)";"happiness; blessing; good fortune. mercy"
611;拘;1;コウ;かかわ;koo;"seize, arrest";-;-
612;肯;2;コウ;;koo;"agree to, consent, comply with, undertake";-;-
613;侯;1;コウ;;koo;"marquis; load, daimyo";-;-
614;厚;2;コウ、あつ-い;;koo;"very thick; heavy";atsu(i);"thick; kind, cordial"
615;恒;1;コウ;つね、づね;koo;always;-;-
616;洪;1;コウ;;koo;"flood, vast";-;-
617;皇;1;コウ、オウ;すめらぎ;"koo, 	oo";emperor;-;-
618;紅;2;コウ、[ク]、べに、くれない;;"koo, [ku]";"red, crimson";"beni, kurenai";"red, crimson; rouge, lipstick. deep red, crimson"
619;荒;2;コウ、あら-い、あ-れる、あ-らす;すさ;koo;"rough, rude, wild, harsh, violent, gruff, fierce ";"ara(i), a(reru), a(rasu)";"rough, rude, wild, harsh, violent, gruff, fierce. be ruined, become stormy; tear around; get chapped. lay waste "
620;郊;2;コウ;;koo;"suburbs; rural area";-;-
621;香;2;コウ、[キョウ]、か、かお-り、かお-る;;"koo, [kyoo]";"incense, fragrance ";"ka, kao(ri), kao(ru)";"smell, scent, odor; aroma, perfume, fragrance, flavor. be fragrant"
622;候;3;コウ、そうろう;そうろ;koo;"season, weather";sooroo;"classical verbal ending equivalent to colloquial"
623;校;5;コウ;ギョウ;koo;"school; (printing) proof; comparison; correction; investigation";-;-
624;耕;2;コウ、たがや-す;;koo;"plow, cultivate";tagaya(su);"plow, cultivate"
625;航;2;コウ;;koo;"navigation; cross over";-;-
626;貢;1;コウ、[ク]、みつ-ぐ;;"koo, [ku]";tribute;mitsu(gu);"support, finance"
627;降;3;コウ、お-りる、お-ろす、ふ-る;くだ;koo;"going down; surrender";"o(riru), o(rosu), fu(ru)";"fall, drop, come down (rain, etc.). come down, go down, step down, descend; get off; land. take down, lower, pull down, lift down, let down, drop; launch; let off (passengers); wear (for the first time); cause (abortion); grate; invoke; exercise; borrow (in subtraction); lock"
628;高;5;コウ、たか-い、たか、たか-まる、たか-める;;koo;high;"taka(i), taka, taka(maru), taka(meru)";"high, tall, lofty, raised, elevated, eminent; exalted, noble; loud, stentorian; expensive; widely known. quantity, volume, amount, sum; rise (in prices); fief. rise; swell; be elevated, be promoted; increase. raise, lift, promote, elevate; improve, enhance; ennoble; heighten; boost "
629;康;2;コウ;やす;koo;peace;-;-
630;控;1;コウ、ひか-える;;koo;"draw in; hold back, suspend (judgment); refrain from; be moderate; write, make notes; wait; have; moderate (a report)";hika(eru);"memo; duplicate; waiting; prop; reserve"
631;梗;0;コウ;;koo;"for the most part; close up";-;-
632;黄;2;コウ、オウ、き、[こ];;"koo, 	oo";yellow;"ki, [ko]";"yellow. turn yellow. yellow tint"
633;喉;0;コウ、のど;;koo;"throat, voice";nodo;"throat, voice"
634;慌;0;コウ、あわ-てる、あわ-ただしい;;koo;"be confused, lose one's head, be hurried, be hasty";"awa(teru), awa(tadashii)";"be confused, lose one's head, be hurried, be hasty, busy, bustling, confused"
635;港;3;コウ、みなと;;koo;"port, harbor";minato;"port, harbor"
636;硬;2;コウ、かた-い;;koo;"hard, solid; tough, rigid; tight; steady, firm; strict; safe, reliable, upright; chaste, constant; stiff; bookish; classical; stubborn";kata(i);"hard, solid; tough, rigid; tight; steady, firm; strict; safe, reliable, upright; chaste, constant; stiff; bookish; classical; stubborn"
637;絞;1;コウ、しぼ-る、し-める、し-まる;;koo;"strangle, constrict, wring";"shibo(ru), shi(meru), shi(maru)";"strangle, constrict, wring. squeeze, press, extract; milk; close tight; extort; scold"
638;項;1;コウ;うなじ;koo;"clause, paragraph; item; term (in math); argument (in math or linguistics) ";-;-
639;溝;1;コウ、みぞ;;koo;"ditch, gutter, sewer, drain ";mizo;"ditch, gutter, drain; groove, slot; gulf, gap "
640;鉱;2;コウ;あらがね;koo;ore;-;-
641;構;3;コウ、かま-える、かま-う;;koo;"build; keep house; take a posture; assume an attitude; pose as; be ready for; feign, pretend; set up (camp) ";"kama(eru), kama(u)";"build; keep house; take a posture; assume an attitude; pose as; be ready for; feign, pretend; set up (camp). mind, care about; pay attention to; interfere with; be hospitable; tease, molest; expel, banish "
642;綱;1;コウ、つな;;koo;"class (in zoology)";tsuna;"rope, cord, string, line, hawser, cable; morality"
643;酵;1;コウ;;koo;fermentation;-;-
644;稿;1;コウ;;koo;"copy, manuscript, draft; crest (of waves)";-;-
645;興;1;コウ、キョウ、おこ-る、おこ-す;お;"koo, 	kyoo";"interest, entertainment, pleasure ";"oko(ru), oko(su)";"rise, flourish. revive, retrieve (fortunes), raise up "
646;衡;1;コウ;;koo;"measuring rod; scales";-;-
647;鋼;1;コウ、はがね;;koo;steel;hagane;steel
648;講;2;コウ;;koo;"lecture, club, association ";-;-
649;購;1;コウ;あがな;koo;buy;-;-
650;乞;0;こ-う;;-;-;ko(u);"ask, request; invite; pray for; beg, solicit"
651;号;3;ゴウ;;goo;"number; item, title, pseudonym; Buddhist name ";-;-
652;合;3;ゴウ、ガッ、[カッ]、あ-う、あ-わす、あ-わせる;コウ;"goo, gaQ, [kaQ]";one-tenth;"a(u), a(wasu), a(waseru)";"fit, suit; agree with, match, be correct; pay, be profitable. join together; be opposite, face; unite, combine, connect; add up; mix; match; overlap; compare; check with "
653;拷;1;ゴウ;;goo;"beat, torture";-;-
654;剛;1;ゴウ;コウ、つよ;goo;strength;-;-
655;傲;0;ゴウ;おご;goo;"be proud";-;-
656;豪;1;ゴウ;つよ;goo;"great, powerful, excelling";-;-
657;克;1;コク;か、よ;koku;"win; prevail, predominate, surpass ";-;-
658;告;3;コク、つ-げる;;koku;"tell, inform, announce, proclaim; bid, order ";tsu(geru);"tell, inform, announce, proclaim; bid, order "
659;谷;2;コク、たに;きわ;koku;"valley, dale, ravine; trough (of a wave); trough (in atmospheric pressure) ";tani;"valley, dale, ravine; trough (of a wave); trough (in atmospheric pressure) "
660;刻;3;コク、きざ-む;;koku;"time; carving, engraving, cutting ";kiza(mu);"cut fine, chop up; mince, hash; carve (images); engrave (seals); chisel, cut, notch "
661;国;5;コク、くに;;koku;country;kuni;"country, land, realm; province; native land "
662;黒;4;コク、くろ、くろ-い;;koku;"black; dark";"kuro, kuro(i)";"black; dark, swarthy, browned; dirty"
663;穀;1;コク;;koku;"cereals, grain";-;-
664;酷;1;コク;きび;koku;"severity, cruelty";-;-
665;獄;1;ゴク;ひとや;goku;"prison, jail";-;-
666;骨;2;コツ、ほね;;kotsu;"bone; remains; knack";hone;"bone; skeleton; frame; rib (of an umbrella); grit, backbone; effort, pains "
667;駒;1;こま;ク;-;-;koma;"horse; colt, pony; chessman; frame (of a film); bridge (of a violin)"
668;込;3;こ-む、こ-める;;-;-;"ko(mu), ko(meru)";"be crowded; requiring (a lot of work). include; load (a gun); concentrate on; devote oneself to"
669;頃;0;ころ;ケイ;-;-;koro;"time, period. about (regarding time)"
670;今;5;コン、キン、いま;;"kon, 	kin";"now, the present; the coming; this ";ima;"now, present time; just now, soon, immediately; (one) more "
671;困;3;コン、こま-る;;kon;"be distressed be in trouble, be destitute, be embarrassed, be perplexed, be annoyed ";koma(ru);"be distressed be in trouble, be destitute, be embarrassed, be perplexed, be annoyed "
672;昆;1;コン;;kon;"descendants, elder brother";-;-
673;恨;1;コン、うら-む、うら-めしい;;kon;"bear a grudge, show resentment";"ura(mu), ura(meshii)";"bear a grudge, show resentment, hateful, bitter"
674;根;2;コン、ね;;kon;"root (of a plant); root, radical (in science and math); stamina ";ne;"root; base (of a hill); head (of a boil); origin; foundation; peak"
675;婚;3;コン;;kon;marriage;-;-
676;混;2;コン、ま-じる、ま-ざる、ま-ぜる、こ-む;;kon;"mix; blend; adulterate; confound, confuse ";"ma(jiru), ma(zaru), ma(zeru), ko(mu)";"mix, blend, mingle; include, let in on. be mixed, be blended; mingle with "
677;痕;0;コン、あと;;kon;"mark; footprint";ato;"mark; footprint"
678;紺;1;コン;;kon;"dark blue, navy blue";-;-
679;魂;1;コン、たましい;;kon;"soul, spirit";tamashii;"soul, spirit"
680;墾;1;コン;;kon;"open up farmland";-;-
681;懇;1;コン、ねんご-ろ;;kon;"kind, courteous, hospitable, cordial";nengo(ro);"kind, courteous, hospitable, cordial"
682;左;5;サ、ひだり;;sa;"left; the following";hidari;"left; the left; leftist"
683;佐;1;サ;たす;sa;help;-;-
684;沙;1;サ;シャ、すな;sa;sand;-;-
685;査;2;サ;;sa;investigate;-;-
686;砂;2;サ、シャ、すな;;"sa, 	sha";sand;suna;sand
687;唆;1;サ、そそのか-す;;sa;"tempt, seduce; instigate; promote";sosonoka(su);"tempt, seduce; instigate; promote"
688;差;3;サ、さ-す;;sa;"difference, variation; discrepancy; margin; balance; remainder (in subtraction) ";sa(su);"raise (the hands); stretch out( the hands in dancing); put up (an umbrella); carry (on the shoulder); build (a hut); stretch (a rope); graft (trees); carry (in the belt); lift up; offer. (the sun) shines; appear on the surface"
689;詐;1;サ;いつわ;sa;"lie, falsify; deceive; pretend; deceive, cheat ";-;-
690;鎖;1;サ、くさり;と;sa;"chain; irons; connection";kusari;"chain; irons; connection"
691;座;3;ザ、すわ-る;サ、くら、ぐら;za;"seat, cushion; throne; a gathering; stand, pedestal, platform; (metal) washer; theater; troupe; constellation ";suwa(ru);"squat down, sit down, (eyes) are fixed on "
692;挫;0;ザ;くじ;za;"crush, break, sprain, dislocate; frustrate; unnerve; dampen(spirits)";-;-
693;才;3;サイ;;sai;"ability, talent, aptitude, genius, acumen, intelligence, wit; cubic foot; year, age; time; occasion; opportunity; limit; vicinity ";-;-
694;再;2;サイ、[サ]、ふたた-び;;"sai, [sa]";"again, twice";futata(bi);"again, twice"
695;災;1;サイ、わざわ-い;;sai;"calamity, misfortune, woe, evil, curse";wazawa(i);"calamity, misfortune, woe, evil, curse"
696;妻;3;サイ、つま;め;sai;"(my) wife";tsuma;"wife, spouse"
697;采;1;サイ;;sai;"dice; form, appearance";-;-
698;砕;1;サイ、くだ-く、くだ-ける;;sai;"break, smash, crush; pulverize; tax (one's ingenuity); explain simply ";"kuda(ku), kuda(keru)";"break, smash, crush; pulverize; tax (one's ingenuity); explain simply. crumble, be crushed, go to pieces; become familiar "
699;宰;1;サイ;;sai;"manager; rule";-;-
700;栽;1;サイ;;sai;planting;-;-
701;彩;1;サイ、いろど-る;;sai;"color, paint, make up";irodo(ru);"color, paint, make up"
702;採;2;サイ、と-る;;sai;"take, hold, seize, catch, capture; fetch; receive, procure, obtain; adopt (a measure); engage (graduates); choose; order (foodstuffs); pick, pluck; make, produce; eat, set up (camp); charge; administer; transact; take (pains); make out (the meaning); remove; take off (one's hat); take out (spots); strike out (words); weed, catch (fish); deprive of; steal; capture (territory), annex; need, require; reserve (rooms); subscribe to; press (a point home); take (a picture); possess";to(ru);"take, hold, seize, catch, capture; fetch; receive, procure, obtain; adopt (a measure); engage (graduates); choose; order (foodstuffs); pick, pluck; make, produce; eat, set up (camp); charge; administer; transact; take (pains); make out (the meaning); remove; take off (one's hat); take out (spots); strike out (words); weed, catch (fish); deprive of; steal; capture (territory), annex; need, require; reserve (rooms); subscribe to; press (a point home); take (a picture); possess"
703;済;3;サイ、す-む、す-ます;セイ、わた;sai;"end; do without; avoid; be excusable; need not";"su(mu), su(masu)";"end; do without; avoid; be excusable; need not. finish up; settle (one's account); make do"
704;祭;2;サイ、まつ-る、まつ-り;;sai;"offer prayers; celebrate; deify; enshrine; worship";"matsu(ru), matsu(ri)";"offer prayers; celebrate; deify; enshrine; worship. festival, feast"
705;斎;1;サイ;いつき、とき;sai;"Buddhist food; room";-;-
706;細;2;サイ、ほそ-い、ほそ-る、こま-か、こま-かい;ささ;sai;"get thin; taper off";"hoso(i), hoso(ru), koma(ka), koma(kai)";"get thin; taper off. fine (line); thin (voice); slender; narrow (trousers). small, fine; detailed; minor, trifling; elaborate, delicate; stingy, frugal; small (change) "
707;菜;3;サイ、な;;sai;"side dish; greens; vegetables";na;"greens; vegetables; the rape or mustard plant"
708;最;3;サイ、もっと-も;;sai;most;motto(mo);most
709;裁;1;サイ、た-つ、さば-く;;sai;judge;"ta(tsu), saba(ku)";"judge. cut out (a suit); sever, cut off; shut off, interrupt; abstain from; eradicate; suppress"
710;債;1;サイ;;sai;"debt, loan";-;-
711;催;1;サイ、もよお-す;;sai;"hold (a meeting); give (a dinner); feel; show signs of, develop symptoms of, feel (sick) ";moyoo(su);"hold (a meeting); give (a dinner); feel; show signs of, develop symptoms of, feel (sick) "
712;塞;0;サイ、ソク、ふさ-ぐ、ふさ-がる;;"sai, soku";"close, shut, cover, block, wall up obstruct, fill; occupy";"fusa(gu), fusa(garu)";"close, shut, cover, block, wall up obstruct, fill; occupy; be closed, be blocked, be obstructed, be clogged, be shut; be occupied"
713;歳;3;サイ、[セイ];とし;"sai, [sei]";"year, age; time; occasion; opportunity; limit; vicinity ";-;-
714;載;1;サイ、の-せる、の-る;;sai;"ride, board, mount; get up on; spread (paints); be taken in; share in, join; be found in (a dictionary); feel like doing; be mentioned in; be in harmony with ";"no(seru), no(ru)";"ride, board, mount; get up on; spread (paints); be taken in; share in, join; be found in (a dictionary); feel like doing; be mentioned in; be in harmony with. place, put, lay, set; let (one) take part; impose on; record, mention "
715;際;3;サイ、きわ;;sai;"time, occasion; when ";kiwa;"side, edge, verge "
716;埼;0;[さい];さき、ざき;-;-;[sai];"cape, used for the name of prefecture, 'Saitama'"
717;在;3;ザイ、あ-る;;zai;"outskirts, suburbs, country ";a(ru);"there is, have, exist; occur; be located, be contained in; (it) measures; happen; be found; be held; consist of "
718;材;2;ザイ;;zai;"log; timber, lumber, wood; material; talent ";-;-
719;剤;1;ザイ;;zai;"medicine, drug, dose";-;-
720;財;3;ザイ、[サイ];たから;"zai, [sai]";"money, wealth, assets; property";-;-
721;罪;3;ザイ、つみ;;zai;"sin, crime, offense, guilt, blame, fault, misconduct ";tsumi;"sin, crime, offense, guilt, blame, fault, misconduct "
722;崎;1;さき;キ;-;-;saki;"cape, spit, promontory"
723;作;4;サク、サ、つく-る;;"saku, 	sa";"a work, a production; tillage; harvest; ridge (in a field) ";tsuku(ru);"a work, a production; tillage; harvest; ridge (in a field) "
724;削;1;サク、けず-る;;saku;"plane, sharpen, whittle, pare, shave (leather); scrape off; cross out; reduce, curtail ";kezu(ru);"plane, sharpen, whittle, pare, shave (leather); scrape off; cross out; reduce, curtail "
725;昨;3;サク;きのう;saku;"the past; yesterday, last (year)";-;-
726;柵;0;サク;しがらみ;saku;"stockade, fence, palisade";-;-
727;索;1;サク;;saku;"rope, cord ";-;-
728;策;1;サク;;saku;"plan, scheme, policy; step, means; whip";-;-
729;酢;1;サク、す;;saku;vinegar;su;vinegar
730;搾;1;サク、しぼ-る;;saku;"wring, squeeze, press, extract; milk; close tight; extort; scold ";shibo(ru);"wring, squeeze, press, extract; milk; close tight; extort; scold "
731;錯;1;サク;;saku;"mix, be in discorder";-;-
732;咲;2;さ-く;;-;-;sa(ku);"bloom, blossom"
733;冊;2;サツ、サク;;"satsu, 	saku";"volume, book, letter; book counter ";-;-
734;札;2;サツ、ふだ;;satsu;"paper money, counter for bonds, etc";fuda;"tag, placard; name plate; check; charm, (playing) card; tender, bid"
735;刷;2;サツ、す-る;はけ、ばけ;satsu;print;su(ru);print
736;刹;0;サツ、セツ;;"satsu, setsu";temple;-;-
737;拶;0;サツ;;satsu;"be imminent";-;-
738;殺;3;サツ、[サイ]、[セツ]、ころ-す;;"satsu, [sai], [setsu]";"kill, murder, butcher; waste (money); suppress (anger); hold (breath); put off, strike out ";koro(su);"kill, murder, butcher; waste (money); suppress (anger); hold (breath); put off, strike out "
739;察;3;サツ;;satsu;"presume, surmise; judge; realize, understand; imaging, suppose; sympathize with ";-;-
740;撮;1;サツ、と-る;つま;satsu;"pick, pinch; hold in the fingers; summarize ";to(ru);"take (pictures)"
741;擦;1;サツ、す-る、す-れる;こす;satsu;"rub, scour, scrub, scratch, scrape, brush ";"su(ru), su(reru)";"rub, chafe; strike (a match); frost (glass). wear; become sophisticated "
742;雑;3;ザツ、ゾウ;;"zatsu, 	zoo";"miscellany; miscellaneous";-;-
743;皿;2;さら;;-;-;sara;"dish; a helping; a course"
744;三;5;サン、み、み-つ、みっ-つ;;san;three;"mi, mi(tsu), mit(tsu)";three
745;山;5;サン、やま;セン、ゼン;san;"mount, mountain";yama;"mountain, hill, height, knoll; heap, pile; crown (of a hat); seam (of an obi); speculation, adventure; climax, acme, crisis; forest; mine "
746;参;3;サン、まい-る;;san;"three; going; coming; visiting";mai(ru);"go; come; call, visit; visit a shrine; be defeated; be nonplussed; be madly in love; die "
747;桟;1;サン;さじき;san;"crosspiece, cleat, frame, door bolt; shelf; jetty; suspension bridge";-;-
748;蚕;1;サン、かいこ;ごかい;san;"silk worm";kaiko;"silk worm"
749;惨;1;サン、ザン、みじ-め;;"san, 	zan";"disaster; cruelty; wretchedness";miji(me);"sad, pitiful, wretched"
750;産;3;サン、う-む、う-まれる、うぶ;;san;"childbirth; product; native (of a place); fortune, property ";"u(mu), u(mareru), ubu";"bear, give birth to, breed, spawn; produce, yield (interest). be born"
751;傘;1;サン、かさ;;san;"umbrella, parasol";kasa;"umbrella, parasol"
752;散;3;サン、ち-る、ち-らす、ち-らかす、ち-らかる;;san;"scatter, disperse; spend, squander; dispel, dissipate, chase away ";"chi(ru), chi(rasu), chi(rakasu), chi(rakaru)";"fall, scatter, be scattered, be shed; disperse; (rumor) spreads; run, spread, blur. dissipate (fog); dispel; take down or loosen (the hair); rout; distribute (handbills); distract (attention); splash on (a pattern). scatter (around), disarrange, leave untidy. lie scattered around, be in disorder "
753;算;2;サン;;san;"divining (block); calculation; number; abacus; plan; probability";-;-
754;酸;1;サン、す-い;;san;"acid; bitterness";su(i);"sour, acid, tart"
755;賛;3;サン;;san;"praise; title or brief inscription on picture; agreement";-;-
756;残;3;ザン、のこ-る、のこ-す;;zan;"remainder; balance";"noko(ru), noko(su)";"remain, be left over; stay, linger; survive. leave behind; keep back; leave undone; reserve; save, amass; bequeath "
757;斬;0;ザン、き-る;;zan;beheading;ki(ru);"kill; cut"
758;暫;1;ザン;しばら;zan;"for a while, for a moment; for a long time";-;-
759;士;1;シ;;shi;"samurai; man, gentleman; scholar";-;-
760;子;5;シ、ス、こ;み、ね;"shi, 	su";"viscount, master; child; male; fruit; seed. offspring; the young (of animals) ";ko;"child, offspring; the young (of animals) "
761;支;3;シ、ささ-える;つか;shi;branch;sasa(eru);"support, maintain, sustain, hold; prop, bolster; check, stem "
762;止;4;シ、と-まる、と-める;や;shi;"stop, halt, stand still, pull up; cease, be interrupted, be discontinued; be choked; alight on, perch, roost; be held in position";"to(maru), to(meru)";"stop, halt, stand still, pull up; cease, be interrupted, be discontinued; be choked; alight on, perch, roost; be held in position. check; allay (pain); fasten; turn off; detain; forbid to do; dissuade "
763;氏;1;シ、うじ;;shi;"Mr.; family, clan ";uji;"clan; lineage, birth; surname"
764;仕;4;シ、[ジ]、つか-える;;"shi, [ji]";"official; civil service";tsuka(eru);"serve, work for"
765;史;2;シ;ふみ;shi;"history, chronicles; historian; book";-;-
766;司;2;シ;ス、ズ、つかさど、つかさ;shi;"official; government office";-;-
767;四;5;シ、よ、よ-つ、よっ-つ、よん;;shi;four;"yo, yo(tsu), yot(tsu), yon";four
768;市;3;シ、いち;か、が;shi;"city, town; market";ichi;"market; fair"
769;矢;1;シ、や;;shi;arrow;ya;arrow
770;旨;1;シ、むね;うま;shi;"relish, show a liking for ";mune;"purport; principle; instructions; will, thinking"
771;死;4;シ、し-ぬ;;shi;death;shi(nu);die
772;糸;2;シ、いと;;shi;"thread; one ten-thousandth of a hair";ito;"thread, yarn; gut; string (of a violin); (fish) line  "
773;至;1;シ、いた-る;;shi;"go, proceed, come; arrive, reach, attain; result in, lead to ";ita(ru);"go, proceed, come; arrive, reach, attain; result in, lead to "
774;伺;2;シ、うかが-う;;shi;"visit; ask, inquire, question; hear, be told; implore (a good for an oracle) ";ukaga(u);"visit; ask, inquire, question; hear, be told; implore (a good for an oracle) "
