id;kanji;jlpt;joyo_reading;reading;on;kun;on_trans;kun_trans
1503;豆;1;トウ、[ズ]、まめ;;"too, [zu]";"beans, peas, pulse";mame;"beans, peas, pulse"
1504;東;5;トウ、ひがし;あずま;too;east;higashi;east
1505;到;3;トウ;いた;too;"go, proceed, come; arrive, reach, attain; result in, lead to ";-;-
1506;逃;3;トウ、に-げる、に-がす、のが-す、のが-れる;;too;"flee, run away, escape; shirk, evade, back out ";"ni(geru), ni(gasu), noga(su), noga(reru)";"flee, run away, escape; shirk, evade, back out. let go, set free, let escape, miss (a chance). avoid"
1507;倒;3;トウ、たお-れる、たお-す;;too;"fall, collapse, drop; break down, die, succumb to; fall senseless; be ruined; have a bad debt ";"tao(reru), tao(su)";"fall, collapse, drop; break down, die, succumb to; fall senseless; be ruined; have a bad debt. bring down, throw down, blow down, fell, knock down, trip up; defeat; ruin, overthrow; kill; leave unpaid; cheat "
1508;凍;2;トウ、こお-る、こご-える;;too;"freeze, be frozen over; congeal";"koo(ru), kogo(eru)";"freeze, be frozen over; congeal. freeze, be chilled, be frozen"
1509;唐;0;トウ、から;;too;"Tang (dynasty); China; foreign countries. Chinese; Korean; Foreign";kara;"China; Cathay; Korea; Foreign countries. Chinese; Korean; Foreign"
1510;島;2;トウ、しま;;too;island;shima;island
1511;桃;1;トウ、もも;;too;peach;momo;peach
1512;討;1;トウ、う-つ;;too;"attack, defeat, destroy, conquer";u(tsu);"attack, defeat, destroy, conquer"
1513;透;1;トウ、す-く、す-かす、す-ける;とお;too;"permeate, penetrate ";"su(ku), su(kasu), su(keru)";"be transparent; be seen through; be thin; leave a gap. leave a space; thin (trees); make transparent; look through"
1514;党;2;トウ;;too;"party, faction, clique; companions";-;-
1515;悼;1;トウ、いた-む;;too;"grieve over";ita(mu);"grieve over"
1516;盗;3;トウ、ぬす-む;;too;thief;nusu(mu);"steal, rob, pilfer"
1517;陶;1;トウ;すえ;too;"porcelain, pottery";-;-
1518;塔;2;トウ;;too;"tower, pagoda, steeple, obelisk, monument";-;-
1519;搭;1;トウ;;too;"load (a vehicle); ride";-;-
1520;棟;1;トウ、むね、[むな];;too;"ridge, ridgepole; counter for buildings";"mune, [muna]";"ridge, ridgepole; counter for buildings"
1521;湯;2;トウ、ゆ;タン;too;"hot water";yu;"hot water, hot bath, hot spring"
1522;痘;1;トウ;;too;smallpox;-;-
1523;登;3;トウ、ト、のぼ-る;の;"too, 	to";"rise, ascend, go up, climb; go to (the capital); add up to; be promoted; advance (in price); sail up; come up (on the agenda) ";nobo(ru);"rise, ascend, go up, climb; go to (the capital); add up to; be promoted; advance (in price); sail up; come up (on the agenda) "
1524;答;4;トウ、こた-える、こた-え;;too;answer;"kota(eru), kota(e)";"answer; respond; solve. solution"
1525;等;3;トウ、ひと-しい;ら、ま;too;"class, grade, degree";hito(shii);"equal, similar, alike, equivalent"
1526;筒;2;トウ、つつ;;too;"pipette, tube";tsutsu;"pipe, tube, case, gun barrel, sleeve, well curb"
1527;統;1;トウ、す-べる;;too;"relationship; lineage; beginning";su(beru);"control, supervise, govern"
1528;稲;1;トウ、いね、[いな];;too;"rice plant";"ine, [ina]";"rice plant"
1529;踏;1;トウ、ふ-む、ふ-まえる;;too;"step on, trample on, stamp on; carry through, practice; appraise; set foot on; evade payment ";"fu(mu), fu(maeru)";"step on, trample on, stamp on; carry through, practice; appraise; set foot on; evade payment. stand on"
1530;糖;1;トウ;;too;sugar;-;-
1531;頭;3;トウ、ズ、[ト]、あたま、かしら;ジュウ、かみ、がみ;"too, zu, [to]";"head, counter for large mammals";"atama, kashira";"head; brain, mind, intellect; leader; top; head (of boil); idea; hair; point of view, consideration. leader, chief "
1532;謄;1;トウ;;too;copy;-;-
1533;藤;1;トウ、ふじ;;too;wisteria;fuji;wisteria
1534;闘;1;トウ、たたか-う;;too;fighting;tataka(u);"wage war; fight; engage in a contest; struggle against"
1535;騰;1;トウ;あ;too;"rising; price rise";-;-
1536;同;4;ドウ、おな-じ;;doo;"the same, the said, ibid";ona(ji);"same, identical, equal; uniform; equivalent; similar; common (origin); changeless"
1537;洞;1;ドウ、ほら;トウ;doo;cavity;hora;"cave, den, excavation"
1538;胴;1;ドウ;;doo;"torso, trunk (of a body); body armor; body (of a suit); drum (of a machine); barrel (of a horse); cylinder (of a drum); bulge (of a bucket); hull (of a ship); hub (of a wheel)";-;-
1539;動;4;ドウ、うご-く、うご-かす;;doo;"motion; change; confusion";"ugo(ku), ugo(kasu)";"move, stir, shift, shake, swing; operate, run, go, work; be touched, be influenced, waver, fluctuate, vary, change, be transferred. set in motion, inspire, rouse, influence; mobilize; deny "
1540;堂;4;ドウ;;doo;"temple; shrine; hall; reception room; firm; state chamber. shop, store";-;-
1541;童;2;ドウ、わらべ;わらわ;doo;child;warabe;child
1542;道;4;ドウ、[トウ]、みち;い;"doo, [too]";"district, province, prefecture; road  ";michi;"road, path, lane, way, street, highway, route; journey; distance; course, way, means; duty, morality, moral doctrine; teachings; specialty; an art; reason, justice "
1543;働;3;ドウ、はたら-く;;doo;"work, labor; do, act, commit, practice; work on; come into play; be conjugated; reduce the price ";hatara(ku);"work, labor; do, act, commit, practice; work on; come into play; be conjugated; reduce the price "
1544;銅;2;ドウ;;doo;copper;-;-
1545;導;2;ドウ、みちび-く;;doo;leading;michibi(ku);"guide, lead, conduct, usher"
1546;瞳;1;ドウ、ひとみ;トウ;doo;"pupil of the eye";hitomi;"pupil of the eye"
1547;峠;1;とうげ;;-;-;tooge;"mountain pass; crisis, crest, climax"
1548;匿;1;トク;かく;toku;"shelter, shield, hide";-;-
1549;特;4;トク;;toku;special;-;-
1550;得;3;トク、え-る、う-る;;toku;"profit, advantage, benefit";"e(ru), u(ru)";"get, acquire, acquire, find, earn, win, gain, receive; can, be able to, may; commit (sin) "
1551;督;1;トク;;toku;"command, lead, supervise; urge";-;-
1552;徳;1;トク;;toku;"virtue, goodness; good; gain; power to command respect";-;-
1553;篤;1;トク;あつ;toku;"kind, cordial, fervent, affectionate; serious (illness)";-;-
1554;毒;2;ドク;;doku;"poison; virus, venom, germ, toxin; harm, injury; malice, spite";-;-
1555;独;1;ドク、ひと-り;;doku;alone;hito(ri);"alone, on one's own"
1556;読;5;ドク、トク、[トウ]、よ-む;と、ど;"doku, toku, [too]";reading;yo(mu);"read, peruse; understand, read (one's heart), guess, divine "
1557;栃;0;[とち];;-;-;[tochi];"horse chestnut"
1558;凸;1;トツ;;totsu;"projecting, beetle brow";-;-
1559;突;3;トツ、つ-く;;totsu;"protruding, thrusting";tsu(ku);"thrust, pierce, spear, stab, prick; gore; lunge at; push, poke; strike (a bell); attack; strike (at the heart); brave (a storm); be pungent; strike against; (words) rush (to one's lips) "
1560;届;2;とど-ける、とど-く;;-;-;"todo(keru), todo(ku)";"reach, arrive, be received; be attentive, be realized. report, notice; forwarding, delivery "
1561;屯;1;トン;たむろ;ton;"police station; camp";-;-
1562;豚;1;トン、ぶた;;ton;hog;buta;"pig, hog, swine"
1563;頓;0;トン;とみ;ton;"suddenly, in a hurry, immediately";-;-
1564;貪;0;ドン、むさぼ-る;;don;coveting;musabo(ru);"covet, indulge in"
1565;鈍;2;ドン、にぶ-い、にぶ-る;;don;"dullness, slowness, foolishness";"nibu(i), nibu(ru)";"dull, slow; blunt (tool); dim (light); thick (voice). become dull, weaken "
1566;曇;2;ドン、くも-る;;don;"cloud up; fog up, become dim, be blurred; be gloomy ";kumo(ru);"cloud up; fog up, become dim, be blurred; be gloomy "
1567;丼;0;どんぶり、[どん];;-;-;"donburi, [don]";"bowl; bowl of food"
1568;那;1;ナ;;na;what;-;-
1569;奈;1;ナ;;na;what;-;-
1570;内;3;ナイ、[ダイ]、うち;ノウ、い;"nai, [dai]";"inside, interior, within, between, among. within, within the scope of ";uchi;"inside, interior; house, home; within; between, among, out of; mind; myself. inner "
1571;梨;1;なし;リ;-;-;nashi;"pear; pear tree"
1572;謎;0;なぞ;;-;-;nazo;"riddle, puzzle, enigma; hint, tip"
1573;鍋;0;なべ;;-;-;nabe;"pan, pot, kettle"
1574;南;5;ナン、[ナ]、みなみ;;"nan, [na]";south;minami;south
1575;軟;2;ナン、やわ-らか、やわ-らかい;;nan;soft;"yawa(raka), yawa(rakai)";soft
1576;難;3;ナン、かた-い、むずか-しい;ナ;nan;"trouble, difficulty; accident, disaster; defect; criticism ";"kata(i), muzuka(shii)";"impossible. hard, difficult; delicate; troublesome; doubtful; hopeless; stern; sullen; hard to please; serious; technical "
1577;二;5;ニ、ふた、ふた-つ;ジ;ni;"two, second";"futa, futa(tsu)";two
1578;尼;1;ニ、あま;;ni;nun;ama;nun
1579;弐;1;ニ;;ni;"two, second";-;-
1580;匂;0;にお-う;;-;-;nio(u);"be fragrant, smell; stink; glow, be bright"
1581;肉;4;ニク;;niku;"flesh, muscles; meat; the flesh; seal pad, ink pad; thickness, succulence ";-;-
1582;虹;1;にじ;コウ;-;-;niji;rainbow
1583;日;5;ニチ、ジツ、ひ、か;;"nichi, 	jitsu";"day; Sunday";"hi, ka";"sun; time; day, date"
1584;入;5;ニュウ、い-る、い-れる、はい-る;ジュ、しお;nyuu;"go in, come in; flow into; set; set in ";"i(ru), i(reru), hai(ru)";"go in, come in; flow into; set; set in. put in, take in, bring in, let in, admit, introduce, commit (to prison), usher in; insert; set (jewels); employ; listen to; tolerate, comprehend; include; pay (interest); cast (votes). enter; break into; join; enroll; contain, hold; accommodate; have (an income of) "
1585;乳;2;ニュウ、ちち、ち;;nyuu;"milk; the breasts; loop";"chichi, chi";"milk; the breasts; loop"
1586;尿;1;ニョウ;;nyoo;urine;-;-
1587;任;3;ニン、まか-せる、まか-す;;nin;"duty, responsibility; office; mission; term ";"maka(seru), maka(su)";"entrust to, leave to "
1588;妊;1;ニン;;nin;"become pregnant; be pregnant; be filled with";-;-
1589;忍;1;ニン、しの-ぶ、しの-ばせる;;nin;"bear, endure, put up with; hide (oneself) ";"shino(bu), shino(baseru)";"bear, endure, put up with; hide (oneself). conceal, secrete "
1590;認;3;ニン、みと-める;したた;nin;"witness; sight; discern, authorize, recognize; appreciate; approve of; judge, conclude; believe; regard as ";mito(meru);"witness; sight; discern, authorize, recognize; appreciate; approve of; judge, conclude; believe; regard as "
1591;寧;1;ネイ;やす、むし;nei;preferably;-;-
1592;熱;3;ネツ、あつ-い;;netsu;"heat, warmth; temperature; fever; mania, fad; enthusiasm; passion ";atsu(i);hot
1593;年;5;ネン、とし;;nen;"year; term of service";toshi;"year; age, time of life"
1594;念;3;ネン;;nen;"sense, idea, thought; feeling; desire; concern, attention, care ";-;-
1595;捻;0;ネン;ひね;nen;"pinch (of salt); small gift of money; a twist";-;-
1596;粘;1;ネン、ねば-る;;nen;"be sticky, be glutinous, be greasy; persevere";neba(ru);"be sticky, be glutinous, be greasy; persevere"
1597;燃;2;ネン、も-える、も-やす、も-す;;nen;burn;"mo(eru), mo(yasu), mo(su)";"burn, blaze, glow"
1598;悩;2;ノウ、なや-む、なや-ます;;noo;"distress, illness";"naya(mu), naya(masu)";"worry, be troubled, be afflicted, be in pain. annoy, embarrass, afflict, worry, oppress, torment "
1599;納;1;ノウ、[ナッ]、[ナ]、[ナン]、[トウ]、おさ-める、おさ-まる;い;"noo, [naQ], [na], [nan], [too]";"obtain, reap; dedicate, consecrate; pay; supply; store; finish; collect; restore; replace; accept (a present); burry; gather; rally (troops); sheathe (the sword) ";"osa(meru), osa(maru)";"obtain, reap; dedicate, consecrate; pay; supply; store; finish; collect; restore; replace; accept (a present); burry; gather; rally (troops); sheathe (the sword). be paid; be restored; stay (in the stomach); look composed; be contented; be satisfied; be settled "
1600;能;3;ノウ;ノ、あた、よ、た;noo;"ability, talent, skill, capacity; noh play, classical drama";-;-
1601;脳;2;ノウ;;noo;"brain, memory";-;-
1602;農;2;ノウ;ノ;noo;"agriculture; farmers";-;-
1603;濃;2;ノウ、こ-い;;noo;"dark, thick, undiluted";ko(i);"dark, deep; saturated; strong (drink); intimate; thick"
1604;把;1;ハ;と;ha;"bundle, bunch, sheaf, coil";-;-
1605;波;2;ハ、なみ;;ha;wave;nami;"wave, billows"
1606;派;1;ハ;;ha;"group, party, clique; faction, sect; school (of art, etc.)";-;-
1607;破;3;ハ、やぶ-る、やぶ-れる;わ;ha;"tear, rip, rend; break, crush, destroy; violate, transgress; defeat; baffle, frustrate ";"yabu(ru), yabu(reru)";"tear, rip, rend; break, crush, destroy; violate, transgress; defeat; baffle, frustrate. be torn, rip open; be broken, burst; rupture, collapse; be worn out; be defeated; be frustrated "
1608;覇;1;ハ;;ha;"supremacy, leadership, domination, hegemony; supreme ruler; champion";-;-
1609;馬;3;バ、うま、[ま];メ;ba;horse;"uma, [ma]";"horse; horseflesh"
1610;婆;1;バ;ポ;ba;"old woman; grandmother";-;-
1611;罵;0;バ、ののし-る;;ba;"abuse, insult, speak ill of";nonoshi(ru);"abuse, insult, speak ill of"
1612;拝;2;ハイ、おが-む;;hai;worship;oga(mu);"worship, pray to, adore, reverence; look at (with reverence)"
1613;杯;3;ハイ、さかずき;;hai;"cup, glass; toast, congratulatory cup; counter for cupfuls ";sakazuki;"wine glass, sake cup; chalice, cup"
1614;背;3;ハイ、せ、せい、そむ-く、そむ-ける;;hai;"back, behind";"se, sei, somu(ku), somu(keru)";"act contrary to, go back on, disobey, defy, rebel against, turn one's back on. look away from, avert. back, back side; stature, height; ridge. stature"
1615;肺;1;ハイ;;hai;lung;-;-
1616;俳;1;ハイ;;hai;actor;-;-
1617;配;3;ハイ、くば-る;;hai;"distribute; spouse; exile; rationing";kuba(ru);"distribute; serve (food); allocate; keep (your eyes) on"
1618;排;1;ハイ;;hai;"exclude, expel, reject; push aside, push open; defy; disregard; anti-(Japanese, etc.) ";-;-
1619;敗;3;ハイ、やぶ-れる;;hai;"defeat, reversal";yabu(reru);"be defeated"
1620;廃;1;ハイ、すた-れる、すた-る;;hai;"obsolescence; cessation; discarding";"suta(reru), suta(ru)";"become useless, get out of date, die out; be abolished; decline (in prosperity) "
1621;輩;1;ハイ;ともがら;hai;"fellow, people, companion; line";-;-
1622;売;4;バイ、う-る、う-れる;マイ、メ;bai;selling;"u(ru), u(reru)";"sell, deal in, betray, deceive, impose on, tell on, pick (a quarrel). be in demand, enjoy a large sale; be well known "
1623;倍;2;バイ;ベ;bai;"double, twice; times, -fold";-;-
1624;梅;1;バイ、うめ;メ;bai;"plum, plum tree";ume;"plum, plum tree"
1625;培;1;バイ、つちか-う;;bai;"cultivate, foster";tsuchika(u);"cultivate, foster"
1626;陪;1;バイ;;bai;"follow, accompany, attend on";-;-
1627;媒;1;バイ;なかだち、なこうど;bai;go-between;-;-
1628;買;4;バイ、か-う;;bai;buying;ka(u);"buy, invest in; incur; appreciate; call in (geisha) "
1629;賠;1;バイ;;bai;indemnify;-;-
1630;白;5;ハク、ビャク、しろ、[しら]、しろ-い;;"haku, 	byaku";white;"shiro, [shira], shiro(i)";"white, fair (skin); gray (hair); blank (paper); spotless; innocent. feigned ignorance "
1631;伯;1;ハク;;haku;"count; earl; eldest brother; uncle; chief official";-;-
1632;拍;1;ハク、[ヒョウ];;"haku, [hyoo]";"beat (in music)";-;-
1633;泊;2;ハク、と-まる、と-める;;haku;"(three-day) stay";"to(maru), to(meru)";"stay at, put up at; ride at anchor. lodge a person "
1634;迫;1;ハク、せま-る;;haku;"press for, urge, force, spur on; approach; gain on, close in on; be on the verge of; be imminent ";sema(ru);"press for, urge, force, spur on; approach; gain on, close in on; be on the verge of; be imminent "
1635;剥;0;ハク、は-がす、は-ぐ、は-がれる、は-げる;む;haku;"come off, peel off, be worn off; fade, discolor";"ha(gasu), ha(gu), ha(gareru), ha(geru)";"come off, peel off, be worn off; fade, discolor; rip off, strip off; skin, flay; disrobe; deprive of"
1636;舶;1;ハク;;haku;ship;-;-
1637;博;1;ハク、[バク];ひろ;"haku, [baku]";"command esteem, win acclaim; gain, receive. doctor, PhD; exposition, fair, exhibition";-;-
1638;薄;2;ハク、うす-い、うす-める、うす-まる、うす-らぐ、うす-れる;すすき;haku;"thin, weak (tea), light, pale, faint, scanty, ungenerous ";"usu(i), usu(meru), usu(maru), usu(ragu), usu(reru)";"thin, weak (tea), light, pale, faint, scanty, ungenerous. dilute, weaken. thin out, fade, grow pale, be toned down, get dim, cool (emotions), abate, lessen, decline "
1639;麦;2;バク、むぎ;;baku;"wheat, barley, oats, rye";mugi;"wheat, barley, oats, rye"
1640;漠;1;バク;ひろ;baku;"vague, obscure; deserd; wide";-;-
1641;縛;1;バク、しば-る;;baku;"arrest, binding";shiba(ru);"bind, tie, fasten, truss, fetter, restrain, chain; arrest, catch "
1642;爆;2;バク;;baku;"burst open, pop, split";-;-
1643;箱;3;はこ;;-;-;hako;"box, case, chest, bin, coffer, railway car "
1644;箸;0;はし;;-;-;hashi;chopsticks
1645;畑;0;はた、はたけ;;-;-;"hata, hatake";"field, farm, plantation, garden; one's specialty"
1646;肌;2;はだ;キ;-;-;hada;"skin, body; grain, texture; disposition"
1647;八;5;ハチ、や、や-つ、やっ-つ、[よう];ハツ;hachi;eight;"ya, ya(tsu), yat(tsu), [yoo]";eight
1648;鉢;1;ハチ、[ハツ];;"[hatsu], 	hachi";"bowl, rice tub, pot; crown, brainpan";-;-
1649;発;4;ハツ、ホツ;;"hatsu, 	hotsu";"departure; discharge (of a gun)";-;-
1650;髪;3;ハツ、かみ;;hatsu;"the hair";kami;"the hair"
1651;伐;1;バツ;き、う;batsu;"strike, attack; punish";-;-
1652;抜;3;バツ、ぬ-く、ぬ-ける、ぬ-かす、ぬ-かる;;batsu;"extract, unlock, pull out; root up; unsheathe; pilfer; quote; remove; omit; capture; outrun; shoot through";"nu(ku), nu(keru), nu(kasu), nu(karu)";"extract, unlock, pull out; root up; unsheathe; pilfer; quote; remove; omit; capture; outrun; shoot through. come off, fall out, slip out; be omitted; be missing; be rid of; pass through; escape; be captured; withdraw; be less than. skip over. be careless; slip, make a mistake "
1653;罰;1;バツ、バチ;;"batsu, 	bachi";"punishment, penalty";-;-
1654;閥;1;バツ;;batsu;"lineage, pedigree; clique, faction, clan";-;-
1655;反;3;ハン、[ホン]、[タン]、そ-る、そ-らす;;"han, [hon], [tan]";"antithesis, opposite, antagonism; anti-. roll of cloth (c. 10yds.); .245 acres, 300 tsubo";"so(ru), so(rasu)";"warp; curve; lean backward. bend, warp "
1656;半;5;ハン、なか-ば;;han;"half; odd number; semi-, hemi-, demi-";naka(ba);"half, semi-, middle, halfway; partly"
1657;氾;0;ハン;;han;"spread out; wide";-;-
1658;犯;3;ハン、おか-す;ボン;han;"offense, crime; counter for criminal offenses ";oka(su);"commit, sin against; violate, break; defy, disregard; attack, assault; seduce, rape"
1659;帆;1;ハン、ほ;;han;sail;ho;sail
1660;汎;0;ハン;;han;pan-;-;-
1661;伴;1;ハン、バン、ともな-う;とも;"han, 	ban";"accompany, bring with; be accompanied by; be involved in ";tomona(u);"accompany, bring with; be accompanied by; be involved in "
1662;判;3;ハン、バン;わか;"han, 	ban";"stamp, seal; a monogram signature; judgment";-;-
1663;坂;2;ハン、さか;;han;"incline, slope, hill";saka;"incline, slope, hill"
1664;阪;3;ハン;さか、ざか;han;slope;-;-
1665;板;2;ハン、バン、いた;;"han, 	ban";"board, plank; planking; plate, sheet; the stage";ita;"board, plank; planking; plate, sheet; the stage"
1666;版;2;ハン;;han;"printing block or plate; printing; edition, impression; board; label";-;-
1667;班;1;ハン;;han;"corps, unite, squad; party, companions, group; order";-;-
1668;畔;1;ハン;ほとり、あぜ、くろ、ぐろ;han;"rice-paddy ridge, levee";-;-
1669;般;2;ハン;;han;"carry; all";-;-
1670;販;2;ハン;;han;"sell, trade";-;-
1671;斑;0;ハン;まだら、ふ;han;spot;-;-
1672;飯;4;ハン、めし;いい;han;"cooked rice; meal; food";meshi;"cooked rice; meal; food, livelihood"
1673;搬;1;ハン;;han;"carry, transport";-;-
1674;煩;1;ハン、[ボン]、わずら-う、わずら-わす;;"han, [bon]";"worry, trouble";"wazura(u), wazura(wasu)";"be ill; worry, be afflicted, be in pain, be troubled. trouble, keep (someone) busy, disturb, annoy "
1675;頒;1;ハン;;han;"divide, separate; share with; distinguish between";-;-
1676;範;1;ハン;のり;han;"example, model, pattern; limit";-;-
1677;繁;1;ハン;しげ;han;"frequency, complexity, trouble ";-;-
1678;藩;1;ハン;;han;"feudal clan; enclosure";-;-
1679;晩;3;バン;;ban;"evening, night; the end of all things; late";-;-
1680;番;3;バン;つが;ban;"watch, guard; duty; number; order; size, game, round, turn, bout";-;-
1681;蛮;1;バン;;ban;barbarian;-;-
1682;盤;1;バン;ハン;ban;"shallow bowl, platter, tray, tub; board; phonograph record";-;-
1683;比;2;ヒ、くら-べる;;hi;"ratio; comparison; an equal, a match ";kura(beru);"compare, balance, contrast"
1684;皮;2;ヒ、かわ;;hi;"skin; hide; leather; fur, pelt; bark; peeling, husk, shell; film, cream ";kawa;"skin; hide; leather; fur, pelt; bark; peeling, husk, shell; film, cream "
1685;妃;1;ヒ;;hi;"queen, princess";-;-
1686;否;3;ヒ、いな;;hi;"no, noes";ina;"no, nay"
1687;批;2;ヒ;;hi;strike;-;-
1688;彼;3;ヒ、かれ、[かの];か;hi;"he; that";"kare, [kano]";"he. that, the "
1689;披;1;ヒ;;hi;open;-;-
1690;肥;1;ヒ、こ-える、こえ、こ-やす、こ-やし;;hi;"get fat; get fertile";"ko(eru), koe,ko(yasu), ko(yashi)";"get fat; get fertile. fertilize, enrich; fatten; feather one's nest; pamper one's taste. manure, fertilizer. night soil "
1691;非;3;ヒ;;hi;"mistake; misdeed; injustice; wrong; non-, un-, anti-";-;-
1692;卑;1;ヒ、いや-しい、いや-しむ、いや-しめる;;hi;"humble; base, mean, vile, vulgar; greedy ";"iya(shii), iya(shimu), iya(shimeru)";"humble; base, mean, vile, vulgar; greedy. despise "
1693;飛;3;ヒ、と-ぶ、と-ばす;;hi;"fly; skip (pages)";"to(bu), to(basu)";"fly; skip (pages). fly (a kite); let fly; blow away; scatter; splash; drive fast; skip over, omit; issue, send out "
1694;疲;3;ヒ、つか-れる;;hi;"get tired, grow weary ";tsuka(reru);"get tired, grow weary "
1695;秘;1;ヒ、ひ-める;;hi;secret;hi(meru);"conceal, keep a secret"
1696;被;2;ヒ、こうむ-る;かず、かぶ;hi;receiving;koomu(ru);"get, receive, sustain (an injury), be subjected to (criticism)"
1697;悲;3;ヒ、かな-しい、かな-しむ;;hi;"grieve, be sad, deplore, mourn for, regret ";"kana(shii), kana(shimu)";"grieve, be sad, deplore, mourn for, regret. sad, pathetic, plaintive "
1698;扉;1;ヒ、とびら;;hi;"door; title page, front page";tobira;"door; title page, front page"
1699;費;3;ヒ、つい-やす、つい-える;;hi;"expenses, cost";"tsui(yasu), tsui(eru)";"spend, consume, waste. become less; be wasted "
1700;碑;1;ヒ;いしぶみ;hi;"monument, tombstone";-;-
1701;罷;1;ヒ;まか、や;hi;"end, stop, cease; subside, calm down, pass; die out, be extinguished; leave, go off; be abandoned ";-;-
1702;避;1;ヒ、さ-ける;;hi;"avoid, avert, ward off, keep aloof from, stay away from; evade, shirk, shun ";sa(keru);"avoid, avert, ward off, keep aloof from, stay away from; evade, shirk, shun "
1703;尾;1;ビ、お;ミ;bi;"tail; end; counter for fish";o;"tail; trail (of a meteor); lower slope (of a mountain)"
1704;眉;1;ビ、[ミ]、まゆ;;"bi, [mi]";eyebrow;mayu;eyebrow
1705;美;3;ビ、うつく-しい;ミ、うま、よ;bi;"beauty, grace, charm";utsuku(shii);"beautiful, lovely, fine, good-looking; picturesque; sweet (voice), noble, pure"
1706;備;3;ビ、そな-える、そな-わる;つぶさ;bi;"be furnished with, be endowed with, possess; be among, be one of ";"sona(eru), sona(waru)";"be furnished with, be endowed with, possess; be among, be one of. furnish, provide, equip, install; have ready; prepare; possess, have; be endowed with; be armed with  "
1707;微;1;ビ;ミ、かす;bi;"minuteness; insignificance; vagueness; fewness";-;-
1708;鼻;2;ビ、はな;;bi;nasal;hana;"nose; snout, muzzle"
1709;膝;0;ひざ;シツ、シッ;-;-;hiza;"knee; lap"
1710;肘;0;ひじ;チュウ;-;-;hiji;"elbow; arm (of something)"
1711;匹;2;ヒツ、ひき;ピキ;hitsu;"head, counter (small animals); roll of cloth ";hiki;"head, counter (small animals); roll of cloth "
1712;必;3;ヒツ、かなら-ず;;hitsu;certainly;kanara(zu);"certainly, positively, invariably"
1713;泌;1;ヒツ、ヒ;;"hitsu, 	hi";"flow; soak in; penetrate; secrete";-;-
1714;筆;2;ヒツ、ふで;;hitsu;"writing brush, paintbrush; writing, drawing, painting; the pen; handwriting, penmanship; literary work ";fude;"writing brush, paintbrush; writing, drawing, painting; the pen; handwriting, penmanship; literary work "
1715;姫;1;ひめ;キ;-;-;hime;"princess; young lady of birth. little, pretty"
1716;百;5;ヒャク;もも;hyaku;"hundred; a great number; all";-;-
1717;氷;2;ヒョウ、こおり、ひ;こお;hyoo;"freeze; be frozen over; congeal";"koori, hi";"ice; shaved ice. hail"
1718;表;3;ヒョウ、おもて、あらわ-す、あらわ-れる;;hyoo;"table, schedule, diagram, chart, list ";"omote, arawa(su), arawa(reru)";"express, show, manifest. appear, emerge, come in sight, show up; be revealed, be discovered, be mentioned; become famous. surface, right side, face; exterior, outside; front; the street; mat covers; head (of a coin); first half (of an inning) "
1719;俵;1;ヒョウ、たわら;;hyoo;"bag, bale, sack; bag counter";tawara;"bag, bale, sack; bag counter"
1720;票;1;ヒョウ;;hyoo;"label; ballot; ticket; sign";-;-
1721;評;2;ヒョウ;;hyoo;"criticism, comment ";-;-
1722;漂;1;ヒョウ、ただよ-う;;hyoo;"float (on the water)";tadayo(u);"float (on the water)"
1723;標;2;ヒョウ;;hyoo;"signpost; mark; target; designate";-;-
1724;苗;1;ビョウ、なえ、[なわ];ミョウ;byoo;"seedling, sapling, shoot";"nae, [nawa]";"seedling, sapling, shoot"
